<?xml version="1.0" encoding="UTF-8"?>
<templates xmlns="http://template.core.maf.j2ee5.seda.com"
	xmlns:xsi="http://www.w3.org/2001/XMLSchema-instance"
	xsi:schemaLocation="http://template.core.maf.j2ee5.seda.com ../../../WEB-INF/xsd/maf-templates.xsd">

	  <default>/applications/templates/default/default.jsp</default>
	
	  <bundle>org.seda.payer.manager.resources.TemplateStrings</bundle>
	  
	  <template name="errori">
		<url>/applications/templates/default/error_template.jsp</url>
	  </template>
	
	  <screen name="blackbox" template="default">
	    <parameter key="pagetitle" value="manager.blackbox.search.title" direct="true" />
	  	<parameter key="header" value="/applications/templates/shared/bolzano/header.jsp"/>
	    <parameter key="menu" value="/applications/templates/shared/menu.jsp" />
	    <parameter key="main" value="/applications/payer/blackboxconfig/bolzano/include/blackBox.jsp" />  <!-- LP PG210070 - 20210729 -->
	   <parameter key="footer" value="/applications/templates/shared/bolzano/footer.jsp"/>
	  </screen>
	   <screen name="blackboxEdit" template="default">
	    <parameter key="pagetitle" value="manager.blackbox.search.title" direct="true" />
	  	<parameter key="header" value="/applications/templates/shared/bolzano/header.jsp"/>
	    <parameter key="menu" value="/applications/templates/shared/menu.jsp" />
	    <parameter key="main" value="/applications/payer/blackboxconfig/bolzano/include/blackBoxEdit.jsp" />  <!-- LP PG210070 - 20210729 -->
	    <parameter key="footer" value="/applications/templates/shared/bolzano/footer.jsp"/>
	  </screen>
	  <screen name="blackboxCancel" template="default">
	    <parameter key="pagetitle" value="manager.blackbox.search.title" direct="true" />
	  	<parameter key="header" value="/applications/templates/shared/bolzano/header.jsp"/>
	    <parameter key="menu" value="/applications/templates/shared/menu.jsp" />
	    <parameter key="main" value="/applications/payer/blackboxconfig/include/blackbox_cancel.jsp" />
	    <parameter key="footer" value="/applications/templates/shared/bolzano/footer.jsp"/>
	  </screen>
	  
	  
  	  <screen name="blackboxpos" template="default">
	    <parameter key="pagetitle" value="manager.blackbox.search.title" direct="true" />
	  	<parameter key="header" value="/applications/templates/shared/bolzano/header.jsp"/>
	    <parameter key="menu" value="/applications/templates/shared/menu.jsp" />
	    <parameter key="main" value="/applications/payer/blackboxconfig/include/blackBoxPos.jsp" />
	   <parameter key="footer" value="/applications/templates/shared/bolzano/footer.jsp"/>
	  </screen>
	   <screen name="blackboxposEdit" template="default">
	    <parameter key="pagetitle" value="manager.blackbox.search.title" direct="true" />
	  	<parameter key="header" value="/applications/templates/shared/bolzano/header.jsp"/>
	    <parameter key="menu" value="/applications/templates/shared/menu.jsp" />
	    <parameter key="main" value="/applications/payer/blackboxconfig/include/blackBoxPosEdit.jsp" />
	    <parameter key="footer" value="/applications/templates/shared/bolzano/footer.jsp"/>
	  </screen>
	  <screen name="blackboxposDelete" template="default">
	    <parameter key="pagetitle" value="manager.blackbox.search.title" direct="true" />
	  	<parameter key="header" value="/applications/templates/shared/bolzano/header.jsp"/>
	    <parameter key="menu" value="/applications/templates/shared/menu.jsp" />
	    <parameter key="main" value="/applications/payer/blackboxconfig/include/blackBoxPosDelete.jsp" />
	    <parameter key="footer" value="/applications/templates/shared/bolzano/footer.jsp"/>
	  </screen>
	  
	  
   	  <screen name="blackboxposlog" template="default">
	    <parameter key="pagetitle" value="manager.blackbox.search.title" direct="true" />
	  	<parameter key="header" value="/applications/templates/shared/bolzano/header.jsp"/>
	    <parameter key="menu" value="/applications/templates/shared/menu.jsp" />
	    <parameter key="main" value="/applications/payer/blackboxconfig/include/blackBoxPosLog.jsp" />
	   <parameter key="footer" value="/applications/templates/shared/bolzano/footer.jsp"/>
	  </screen>
	  <screen name="blackboxposlogDelete" template="default">
	    <parameter key="pagetitle" value="manager.blackbox.search.title" direct="true" />
	  	<parameter key="header" value="/applications/templates/shared/bolzano/header.jsp"/>
	    <parameter key="menu" value="/applications/templates/shared/menu.jsp" />
	    <parameter key="main" value="/applications/payer/blackboxconfig/include/blackBoxPosLogDelete.jsp" />
	    <parameter key="footer" value="/applications/templates/shared/bolzano/footer.jsp"/>
	  </screen>

  </templates>
