<?xml version="1.0" encoding="UTF-8"?>
<templates xmlns="http://template.core.maf.j2ee5.seda.com"
	xmlns:xsi="http://www.w3.org/2001/XMLSchema-instance"
	xsi:schemaLocation="http://template.core.maf.j2ee5.seda.com ../../../WEB-INF/xsd/maf-templates.xsd">

	  <default>/applications/templates/default/default.jsp</default>
	
	  <bundle>org.seda.payer.manager.resources.TemplateStrings</bundle>
	  
	  <template name="errori">
		<url>/applications/templates/default/error_template.jsp</url>
	  </template>
	  
	  <template name="defaultUTF8">
		<url>/applications/templates/default/defaultUTF8.jsp</url>
	  </template>
	  
	  <!-- Start Screen Bolzano -->
	  
	  <screen name="ioitaliaconf" template="default">
	    <parameter key="pagetitle" value="manager.ioitalia.conf.title" direct="true" />
	  	<parameter key="header" value="/applications/templates/shared/bolzano/header.jsp"/>
	    <parameter key="menu" value="/applications/templates/shared/menu.jsp" />
	    <parameter key="main" value="/applications/payer/ioitalia/bolzano/include/ioitaliaconf.jsp" />
	   	<parameter key="footer" value="/applications/templates/shared/bolzano/footer.jsp"/>
	  </screen>
	  
	  <screen name="ioitaliaconfedit" template="default">
	    <parameter key="pagetitle" value="manager.ioitalia.conf.title" direct="true" />
	  	<parameter key="header" value="/applications/templates/shared/bolzano/header.jsp"/>
	    <parameter key="menu" value="/applications/templates/shared/menu.jsp" />
	    <parameter key="main" value="/applications/payer/ioitalia/bolzano/include/ioitaliaconfEdit.jsp" />
	   	<parameter key="footer" value="/applications/templates/shared/bolzano/footer.jsp"/>
	  </screen>
	  
	  <screen name="ioitalia" template="default">
	    <parameter key="pagetitle" value="manager.ioitalia.search.title" direct="true" />
	  	<parameter key="header" value="/applications/templates/shared/bolzano/header.jsp"/>
	    <parameter key="menu" value="/applications/templates/shared/menu.jsp" />
	    <parameter key="main" value="/applications/payer/ioitalia/bolzano/include/ioitalia.jsp" />
	   	<parameter key="footer" value="/applications/templates/shared/bolzano/footer.jsp"/>
	  </screen>
	  
	  <screen name="ioitaliaforniture" template="default">
	    <parameter key="pagetitle" value="manager.ioitalia.search.title" direct="true" />
	  	<parameter key="header" value="/applications/templates/shared/bolzano/header.jsp"/>
	    <parameter key="menu" value="/applications/templates/shared/menu.jsp" />
	    <parameter key="main" value="/applications/payer/ioitalia/bolzano/include/ioitaliaedit.jsp" />
	   	<parameter key="footer" value="/applications/templates/shared/bolzano/footer.jsp"/>
	  </screen>
	  
	  <screen name="ioitalianewmessage" template="defaultUTF8">
	    <parameter key="pagetitle" value="manager.ioitalia.search.title" direct="true" />
	  	<parameter key="header" value="/applications/templates/shared/bolzano/header.jsp"/>
	    <parameter key="menu" value="/applications/templates/shared/menu.jsp" />
	    <parameter key="main" value="/applications/payer/ioitalia/bolzano/include/ioitalianew.jsp" />
	   	<parameter key="footer" value="/applications/templates/shared/bolzano/footer.jsp"/>
	  </screen>
	  
	  <screen name="ioitaliamessageedit" template="defaultUTF8">
	    <parameter key="pagetitle" value="manager.ioitalia.search.title" direct="true" />
	  	<parameter key="header" value="/applications/templates/shared/bolzano/header.jsp"/>
	    <parameter key="menu" value="/applications/templates/shared/menu.jsp" />
	    <parameter key="main" value="/applications/payer/ioitalia/bolzano/include/ioitaliamessageedit.jsp" />
	   	<parameter key="footer" value="/applications/templates/shared/bolzano/footer.jsp"/>
	  </screen>
	  
	  <screen name="ioitaliaupload" template="default">
	    <parameter key="pagetitle" value="manager.ioitalia.upload.title" direct="true" />
	  	<parameter key="header" value="/applications/templates/shared/bolzano/header.jsp"/>
	    <parameter key="menu" value="/applications/templates/shared/menu.jsp" />
	    <parameter key="main" value="/applications/payer/ioitalia/bolzano/include/ioitaliacaricaCsv.jsp" />
	   	<parameter key="footer" value="/applications/templates/shared/bolzano/footer.jsp"/>
	  </screen> 
	  
	  <screen name="ioitaliamessaggiocancel" template="default">
	    <parameter key="pagetitle" value="manager.ioitalia.upload.title" direct="true" />
	  	<parameter key="header" value="/applications/templates/shared/aosta/header.jsp"/>
	    <parameter key="menu" value="/applications/templates/shared/menu.jsp" />
	    <parameter key="main" value="/applications/payer/ioitalia/include/messaggio_cancel.jsp" />
	   	<parameter key="footer" value="/applications/templates/shared/aosta/footer.jsp"/>
	  </screen>
	  
	  <screen name="ioitaliaconfigurazionecancel" template="default">
	    <parameter key="pagetitle" value="manager.ioitalia.upload.title" direct="true" />
	  	<parameter key="header" value="/applications/templates/shared/aosta/header.jsp"/>
	    <parameter key="menu" value="/applications/templates/shared/menu.jsp" />
	    <parameter key="main" value="/applications/payer/ioitalia/include/configurazione_cancel.jsp" />
	   	<parameter key="footer" value="/applications/templates/shared/aosta/footer.jsp"/>
	  </screen>
	  
  </templates>
