<?xml version="1.0" encoding="UTF-8"?>
<templates xmlns="http://template.core.maf.j2ee5.seda.com"
	xmlns:xsi="http://www.w3.org/2001/XMLSchema-instance"
	xsi:schemaLocation="http://template.core.maf.j2ee5.seda.com ../../../WEB-INF/xsd/maf-templates.xsd">

  <default>/applications/templates/default/default.jsp</default>
  
  <bundle>org.seda.payer.manager.resources.TemplateStrings</bundle>
  
  <template name="errori">
	<url>/applications/templates/default/error_template.jsp</url>
  </template>
  

  <screen name="adminusers_search" template="default">
	<parameter key="pagetitle" value="manager.adminusers.search.title" direct="true"/>
    <parameter key="header" value="/applications/templates/shared/lepida/header.jsp" />
    <parameter key="menu" value="/applications/templates/shared/menu.jsp" />
    <parameter key="main" value="/applications/payer/adminusers/include/adminusers_search_lepida.jsp" />
    <parameter key="results" value="/applications/payer/adminusers/include/messages.jsp" />
    <parameter key="footer" value="/applications/templates/shared/lepida/footer.jsp" />
  </screen>

  <screen name="adminusers_add" template="default">
	<parameter key="pagetitle" value="manager.adminusers.add.title" direct="true"/>
    <parameter key="header" value="/applications/templates/shared/lepida/header.jsp" />
    <parameter key="menu" value="/applications/templates/shared/menu.jsp" />
    <parameter key="main" value="/applications/payer/adminusers/include/adminusers_var_lepida.jsp" />
    <parameter key="results" value="/applications/payer/adminusers/include/messages.jsp" />
    <parameter key="footer" value="/applications/templates/shared/lepida/footer.jsp" />
  </screen>

  <screen name="adminusers_add2" template="default">
	<parameter key="pagetitle" value="manager.adminusers.add2.title" direct="true"/>
    <parameter key="header" value="/applications/templates/shared/lepida/header.jsp" />
    <parameter key="menu" value="/applications/templates/shared/menu.jsp" />
    <parameter key="main" value="/applications/payer/adminusers/include/adminusers_var2_lepida.jsp" />
    <parameter key="results" value="/applications/payer/adminusers/include/messages.jsp" />
    <parameter key="footer" value="/applications/templates/shared/lepida/footer.jsp" />
  </screen>

  <screen name="adminusers_edit" template="default">
	<parameter key="pagetitle" value="manager.adminusers.edit.title" direct="true"/>
    <parameter key="header" value="/applications/templates/shared/lepida/header.jsp" />
    <parameter key="menu" value="/applications/templates/shared/menu.jsp" />
    <parameter key="main" value="/applications/payer/adminusers/include/adminusers_var_lepida.jsp" />
    <parameter key="results" value="/applications/payer/adminusers/include/messages.jsp" />
    <parameter key="footer" value="/applications/templates/shared/lepida/footer.jsp" />
  </screen>

  <screen name="adminusers_edit2" template="default">
	<parameter key="pagetitle" value="manager.adminusers.edit2.title" direct="true"/>
    <parameter key="header" value="/applications/templates/shared/lepida/header.jsp" />
    <parameter key="menu" value="/applications/templates/shared/menu.jsp" />
    <parameter key="main" value="/applications/payer/adminusers/include/adminusers_var2_lepida.jsp" />
    <parameter key="results" value="/applications/payer/adminusers/include/messages.jsp" />
    <parameter key="footer" value="/applications/templates/shared/lepida/footer.jsp" />
  </screen>

  <screen name="adminusers_canc" template="default">
	<parameter key="pagetitle" value="manager.adminusers.canc.title" direct="true"/>
    <parameter key="header" value="/applications/templates/shared/lepida/header.jsp" />
    <parameter key="menu" value="/applications/templates/shared/menu.jsp" />
    <parameter key="main" value="/applications/payer/adminusers/include/adminusers_canc.jsp" />
    <parameter key="results" value="/applications/payer/adminusers/include/messages.jsp" />
    <parameter key="footer" value="/applications/templates/shared/lepida/footer.jsp" />
  </screen>


<!-- GESTIONE UTENZE INIZIO -->

  <screen name="seUsers_add" template="default">
	<parameter key="pagetitle" value="manager.seusers.add.title" direct="true"/>
    <parameter key="header" value="/applications/templates/shared/lepida/header.jsp" />
    <parameter key="menu" value="/applications/templates/shared/menu.jsp" />
    <parameter key="main" value="/applications/payer/adminusers/include/seUsers_var_lepida.jsp" />
    <parameter key="results" value="/applications/payer/adminusers/include/messages.jsp" />
    <parameter key="footer" value="/applications/templates/shared/lepida/footer.jsp" />
  </screen>

  <screen name="seUsers_edit" template="default">
	<parameter key="pagetitle" value="manager.seusers.edit.title" direct="true"/>
    <parameter key="header" value="/applications/templates/shared/lepida/header.jsp" />
    <parameter key="menu" value="/applications/templates/shared/menu.jsp" />
    <parameter key="main" value="/applications/payer/adminusers/include/seUsers_var_lepida.jsp" />
    <parameter key="results" value="/applications/payer/adminusers/include/messages.jsp" />
    <parameter key="footer" value="/applications/templates/shared/lepida/footer.jsp" />
  </screen>

  <screen name="seUsers_search" template="default">
	<parameter key="pagetitle" value="manager.seusers.search.title" direct="true"/>
    <parameter key="header" value="/applications/templates/shared/lepida/header.jsp" />
    <parameter key="menu" value="/applications/templates/shared/menu.jsp" />
    <parameter key="main" value="/applications/payer/adminusers/include/seUsers_search_lepida.jsp" />
    <parameter key="results" value="/applications/payer/adminusers/include/messages.jsp" />
    <parameter key="footer" value="/applications/templates/shared/lepida/footer.jsp" />
  </screen>

  <screen name="seUsers_sblocca" template="default">
	<parameter key="pagetitle" value="manager.seusers.sblocca.title" direct="true"/>
    <parameter key="header" value="/applications/templates/shared/lepida/header.jsp" />
    <parameter key="menu" value="/applications/templates/shared/menu.jsp" />
    <parameter key="main" value="/applications/payer/adminusers/include/seUsers_sblocca.jsp" />
    <parameter key="results" value="/applications/payer/adminusers/include/messages.jsp" />
    <parameter key="footer" value="/applications/templates/shared/lepida/footer.jsp" />
  </screen>

  <screen name="seusers_resetpswd" template="default">
	<parameter key="pagetitle" value="manager.adminusers.resetpswd.title" direct="true"/>
    <parameter key="header" value="/applications/templates/shared/lepida/header.jsp" />
    <parameter key="main" value="/applications/payer/adminusers/include/messages.jsp" />
    <parameter key="results" value="/applications/payer/adminusers/include/seUsers_reset_pswd.jsp" />
    <parameter key="footer" value="/applications/templates/shared/lepida/footer.jsp" />
  </screen>

<!-- GESTIONE UTENZE FINE -->

  <screen name="error" template="errori">
  	<parameter key="header" value="/applications/templates/shared/lepida/header.jsp"/>
	<parameter key="content" value="/applications/templates/shared/error_content.jsp" />
  	<parameter key="footer" value="/applications/templates/shared/lepida/footer.jsp"/>
  </screen>  


</templates>
